Titulo,Precio,Año,Kilometraje,Ubicacion,Vendedor,Link,Imagen,Combustible,Transmision,Color,Puertas,Descripcion
Pulidora De 7 2200w Stanley Sl227-b3,388.100,,,,Por Ferretería Luis Penagos,https://www.mercadolibre.com.co/pulidora-de-7-2200w-stanley-sl227-b3/p/MCO25754519#polycard_client=search-nordic&search_layout=grid&position=18&type=product&tracking_id=64ce5b39-9f12-48d9-99a7-825c139a45ce&wid=MCO2906354182&sid=search,https://http2.mlstatic.com/D_Q_NP_2X_769375-MLA88627376812_072025-E.webp,,,,,"Poderoso motor de 2200W para aplicaciones metal mecánicas exigentes.Switch de doble acción para prevenir encendido accidental.Caja de engranajes rotacional para aplicaciones en bordes y esquinas.Interruptor sellado contra polvo.Sistema de expulsión de polvo adecuado para cortes de ladrillos.Acceso rápido para reemplazar las escobillas.Bloqueo de eje para cambio rápido de disco.Sistema de liberación de disco exclusivo.Empuñadura antideslizante y mango auxiliar ergonómico para mayor seguridad.El engranaje en espiral reduce la vibración y el botón de bloqueo permite un trabajo continuo y seguro.Especificaciones técnicas:» Potencia: 2200 W» Velocidad sin carga de 8500 / min. Rpm» Diámetro de Disco: 7pulg (180mm).» Dimensiones: 24 x 12 x 23 cm» Peso: 4,2 Kg."
Pulidora 9 Pulgadas Industrial Ga9020,794.900,,,,Por Belltec,https://articulo.mercadolibre.com.co/MCO-450714523-pulidora-9-pulgadas-industrial-ga9020-_JM#polycard_client=search-nordic&search_layout=grid&position=19&type=item&tracking_id=64ce5b39-9f12-48d9-99a7-825c139a45ce&wid=MCO450714523&sid=search,https://http2.mlstatic.com/D_Q_NP_2X_686818-MCO48249016740_112021-E.webp,,,,,"PRODUCTO:Nombre: PULIDORA 9 PULGADAS INDUSTRIAL GA9020Marca: MAKITADescripción:PULIDORA 9 PULGADAS INDUSTRIALCARACTERÍSTICAS GENERALES- Protección contra la perdida de grasa y contra el polvo.- Motor más potente y duradero, inducido protegido mediante barniz en zig, zag y estator completamente protegido.- Empuñadura antideslizante, para mayor control y confort del operador.- Nuevo formato del cabezal, más robusto y duradero con la posibilidad de girarlo cada 90o.- Interruptor grande para manejarlo fácilmente y poderlo accionar con varios dedosESPECIFICACIONES TÉCNICAS- Potencia: 2.200W- Diámetro de disco: 230mm (9 pulg)- Velocidad sin carga: 6.600- Dimensiones (L x A x A): 473 x 249 x 140mm (18-5/8 x 9-3/4 x 5-1/2 pulg)- Peso neto: 5,8kg (12,8lbs)- Empuñadura lateral- Llave de pivotes- Protector de disco 230mm- Brida de sujeción- Tuerca de brida- Doble Aislamiento- Arranque SuaveMORE DETAILS:Peso del paquete: 1.0 kgCondición: newASIN: B000I6QWSASKU: GA9020GRACIAS POR VISITAR SU TIENDA OFICIAL BELLTEC!!!"
Pulidora 4 1/2  1050w Stanley Sgs1045k-b3,359.800,,,,Por Belltec,https://articulo.mercadolibre.com.co/MCO-606431255-pulidora-4-12-1050w-stanley-sgs1045k-b3-_JM#polycard_client=search-nordic&search_layout=grid&position=20&type=item&tracking_id=64ce5b39-9f12-48d9-99a7-825c139a45ce&wid=MCO606431255&sid=search,https://http2.mlstatic.com/D_Q_NP_2X_840397-MCO48250348594_112021-E.webp,,,,,"PRODUCTO:Nombre: PULIDORA 4 1/2'' 1050W STANLEY SGS1045K-B3Marca: STANLEYDescripción:PULIDORA 4 1/2"" 1050W STANLEY SGS1045K-B3CARACTERÍSTICAS- Cuenta con caja de engranajes metálica que aumenta la vida útil del motor.- Diseño ergonómico: se adapta fácilmente a la forma de la mano.- Interruptor Lock-On.- Traba de eje.- Incluye: 1 pulidora, 1 Llave, 1 Guarda, 1 Caja plástica, 2 Discos.ESPECIFICACIONESVelocidad: 11000 rpmPotencia: 1050WTipo de uso: SemiprofesionalDiámetro disco: 4 1/2 pulgadasTipo de trabajo: ProfesionalCaracterísticas principales:-- Velocidad: 11000 rpm-- Potencia: 1050W-- Tipo de uso: Semiprofesional-- Diámetro disco: 4 1/2 pulgadasMORE DETAILS:Peso del paquete: 1.0 kgCondición: newCPU: 885911513937SKU: SGS1045K-B3GRACIAS POR VISITAR SU TIENDA OFICIAL BELLTEC!!!"
Esmeril De Banco 6 PuLG 1/2 Hp Dewalt Dw752-b3,861.800,,,,Por Belltec,https://articulo.mercadolibre.com.co/MCO-450715082-esmeril-de-banco-6-pulg-12-hp-dewalt-dw752-b3-_JM#polycard_client=search-nordic&search_layout=grid&position=21&type=item&tracking_id=64ce5b39-9f12-48d9-99a7-825c139a45ce&wid=MCO450715082&sid=search,https://http2.mlstatic.com/D_Q_NP_2X_889641-MCO48248603670_112021-E.webp,,,,,"PRODUCTO:Nombre: ESMERIL DE BANCO 6 PULG 1/2 HP DEWALT DW752-B3Marca: DEWALT HERRAMIENTASDESCRIPCIÓN:ESMERIL DE BANCO 6 PULG - 1/2 HP 375W DEWALT DW752-B3CARACTERÍSTICAS- Soportes de aluminio maquinados a precisión permiten al usuario posicionar el material de manera estable- Base y motor de hierro fundido proveen mayor durabilidad- Capacidad de motor de 3450 rpm para remover material a alta velocidad- Interruptor protegido bajo goma- Incluye ruedas abrasivas y protectores acrílicosACCESORIOS INCLUIDOS- Ruedas abrasivas- Protectores acrílicosESPECIFICACIONES- Potencia: 1/2 HP- Watts: 375 W- Velocidad Sin Carga: 3450 RPM- Diametro del Eje: 1/2 pulg- Diámetro máximo del disco: 6 pulg- Peso de la Herramienta: 13,8 kgMÁS DETALLES:Peso del paquete: 11.3 kgCondición: NuevoEAN: 028877498645GTIN: 028877498645SKU: DW752GRACIAS POR VISITAR SU TIENDA OFICIAL BELLTEC!!!"
Pulidora Stanley 9 2200 6500rpm,550.000,,,,,https://www.mercadolibre.com.co/pulidora-stanley-9-2200-6500rpm/p/MCO27715496#polycard_client=search-nordic&search_layout=grid&position=22&type=product&tracking_id=64ce5b39-9f12-48d9-99a7-825c139a45ce&wid=MCO2650545972&sid=search,https://http2.mlstatic.com/D_Q_NP_2X_985694-MLU72226963207_102023-E.webp,,,,,"La pulidora Stanley 9 2200 6500rpm es una herramienta de alto rendimiento diseñada para profesionales y entusiastas del bricolaje. Su motor potente de 2200W garantiza una operación eficiente y constante, ideal para trabajos de pulido intensivos. Esta pulidora está equipada con un disco de 9 pulgadas, lo que permite cubrir una amplia superficie en menos tiempo, aumentando así la productividad.Con una velocidad impresionante de 6500 RPM, esta pulidora Stanley ofrece un rendimiento superior y resultados de alta calidad. Su caja de engranajes metálica asegura una mayor durabilidad y resistencia, incluso en las condiciones más exigentes. Además, incorpora un interruptor sellado contra el polvo, lo que protege la máquina y prolonga su vida útil.El modelo STGL2223-B3 de Stanley es sinónimo de confiabilidad y eficiencia. Como parte de la reconocida marca Stanley, esta pulidora combina la tradición de calidad con la innovación tecnológica. Su número de parte es STGL2223-B3, lo que facilita su identificación y pedido. Con la pulidora Stanley 9 2200 6500rpm, obtendrás resultados profesionales en cada uso."
Pulidora 9 Bosch Professional Gws 28-230,1.495.000,,,,Por Ferricentro,https://www.mercadolibre.com.co/pulidora-9-bosch-professional-gws-28-230/p/MCO22738369#polycard_client=search-nordic&search_layout=grid&position=23&type=product&tracking_id=64ce5b39-9f12-48d9-99a7-825c139a45ce&wid=MCO2775914044&sid=search,https://http2.mlstatic.com/D_Q_NP_2X_851440-MLA84847233883_052025-E.webp,,,,,"PULIDORA 9 BOSCH PROFESSIONAL GWS 28-230CARACTERÍSTICAS- La pulidora de 2800W más ligera del mercado con una excelente relación entre potencia y peso.- Alto rendimiento de arranque de material gracias a su motor Bosch de nueva generación, con escobillas de carbono de larga duración y menor desaceleración en trabajos exigentes.- Sistema de flujo de aire patentado que mejora la refrigeración del motor en un 20%, incrementando rendimiento y durabilidad.- Diseñada para reducir la fatiga del usuario con una significativa disminución de las vibraciones.- Agarre ergonómico para un control superior de la herramienta.- Mayor resistencia a la abrasión frente a partículas de hormigón y metal.- Interruptor de paleta (opcional) para una seguridad incrementada.- Facilidad de reparación con piezas intercambiables con futuras versiones de la herramienta.ESPECIFICACIONES- Potencia: 2.800W- Velocidad: 6.500 rpm- Diámetro de disco: 230 mm- Cabezal de pulido, diámetro: 140 mm- Eje: 5/8""- Peso: 5,9 Kg- Dimensiones de herramienta (anchura): 111 mm- Dimensiones de herramienta (longitud): 550 mm- Dimensiones de herramienta (altura): 137 mmNOTA: No incluye disco."
Pulidora Industrial 9 2600w Dewalt Dwe496-b3,1.432.800,,,,Por Belltec,https://www.mercadolibre.com.co/pulidora-industrial-9-2600w-dewalt-dwe496-b3/p/MCO35093408#polycard_client=search-nordic&search_layout=grid&position=24&type=product&tracking_id=64ce5b39-9f12-48d9-99a7-825c139a45ce&wid=MCO1410229455&sid=search,https://http2.mlstatic.com/D_Q_NP_2X_922290-MLU78310617181_082024-E.webp,,,,,"PULIDORA INDUSTRIAL 9"" 2600W DEWALT DWE496-B3CaracterísticasHerramientas eléctricas diseñadas para el entorno laboral, donde se someten a pruebas rigurosas. La pulidora DWE496-B3 es de uso industrial, equipada con motor protegido contra la abrasión, sistema de expulsión de polvo, mango antivibración y gatillo de encendido.Especificaciones- Potencia de 2600 W- 15 Amperios- 6500 Rpm- Eje 5/8"" - 11 TPI- Diámetro disco 9"" (230mm)- Peso 5.4 kgIncluye- Disco- Guarda- Bridas- Llave- EmpuñadoraPeso del paquete: 1.0 kgEAN: 885911548069ASIN: B07M5DV4F8GTIN: 885911548069SKU: DWE496-B3"
Pulidora Angular De 4-1/2 115mm 620w Slim Stanley Sg6115-b3,189.800,,,,Por Belltec,https://articulo.mercadolibre.com.co/MCO-859654651-pulidora-angular-de-4-12-115mm-620w-slim-stanley-sg6115-b3-_JM#polycard_client=search-nordic&search_layout=grid&position=25&type=item&tracking_id=64ce5b39-9f12-48d9-99a7-825c139a45ce&wid=MCO859654651&sid=search,https://http2.mlstatic.com/D_Q_NP_2X_943488-MCO49101278564_022022-E.webp,,,,,"PRODUCTO:Nombre: PULIDORA ANGULAR DE 4-1/2 115MM 620W SLIM STANLEY SG6115-B3Marca: STANLEYDESCRIPCIÓN:PULIDORA ANGULAR DE 4-1/2 115MM 620W SLIM STANLEY SG6115-B3CARACTERISTICAS- Óptima salida de flujo de aire evita que se sobrecaliente el motor.- Botón grande de bloqueo de eje.- Caja de engranajes compacta para operación en espacios reducidos.- Cuerpo delgado de 179 mm de contorno.- Entrada de aire para contener el ingreso de polvo/residuos, asegurando una mayor vida útil del motor.- Interruptor de dos movimiento para deslizar y oprimir para mayor seguridad.- Guarda a prieba de ruptura de disco que ofrece mayor protección y seguridad.ESPECIFICACIONES- Potencia nominal 620W- Tamaño del disco 4-1/2 (115 mm)- Diámetro de eje M14- Velocidad sin carga 12.000/min (rpm)- Contorno del agarre 179 mm- Longitud del cable 82.67 (2100 mm)- Peso 1.7 KG(1) Pulidora 4.1/2 620W, (1) Guarda, (1) Mango Lateral, (1) LlaveMÁS DETALLES:Peso del paquete: 1.0 kgCondición: NuevoGTIN: 885911719445CPU: 885911719445SKU: SG6115-B3GRACIAS POR VISITAR SU TIENDA OFICIAL BELLTEC!!!"
Minipulidora 4 - 1/2 PuLG Dewalt Dwe4315-b3,797.800,,,,Por Belltec,https://articulo.mercadolibre.com.co/MCO-517777592-minipulidora-4-12-pulg-dewalt-dwe4315-b3-_JM#polycard_client=search-nordic&search_layout=grid&position=26&type=item&tracking_id=64ce5b39-9f12-48d9-99a7-825c139a45ce&wid=MCO517777592&sid=search,https://http2.mlstatic.com/D_Q_NP_2X_703517-MCO48249218161_112021-E.webp,,,,,PRODUCTO:Nombre: MINIPULIDORA 4 - 1/2 PULG DEWALT DWE4315-B3Marca: DEWALTDESCRIPCIÓN:MINI PULIDORA 4 - 1/2 PULG 1500 W - 11000 RPM DEWALT DWE4315-B3CARACTERÍSTICAS- Arranque progresivo- Protección contra corte de corriente- Sistema de protección de sobrecarga y temperatura- Sistema de expulsión de polvoESPECIFICACIONES- Potencia: 1500 W- Velocidad: 11000 RPM- Diámetro máximo de disco: 4 - 1/2 pulg- Peso: 2.6 KgNOTA: Accesorios no incluidosCARACTERÍSTICAS PRINCIPALES:-- Potencia: 1500 W-- Velocidad: 11000 RPM-- Diámetro máximo de disco: 4 - 1/2 pulg-- Peso: 2.6 Kg-NOTA: Accesorios no incluidosMÁS DETALLES:Peso del paquete: 2.93 kgCondición: NuevoEAN: 885911475365ASIN: B071S2Y883GTIN: 885911475365SKU: DWE4315-B3GRACIAS POR VISITAR SU TIENDA OFICIAL BELLTEC!!!
Pulidora Gatillo Hombre Muerto Bosch Gws 9-125p,550.700,,,,Por Belltec,https://www.mercadolibre.com.co/pulidora-gatillo-hombre-muerto-bosch-gws-9-125p/p/MCO26432656#polycard_client=search-nordic&search_layout=grid&position=27&type=product&tracking_id=64ce5b39-9f12-48d9-99a7-825c139a45ce&wid=MCO1330709017&sid=search,https://http2.mlstatic.com/D_Q_NP_2X_683537-MLA84834860555_052025-E.webp,,,,,"PULIDORA GATILLO HOMBRE MUERTO BOSCH GWS 9-125PMarca: BOSCHMINIPULIDORA GATILLO HOMBRE MUERTO BOSCH GWS 9-125PCaracterísticas- La Amoladora Angular Bosch GWS 9 -125 P cuenta con 900 Watts de potencia, adecuada para realizar cortes y desbastes en materiales metálicos, como hierro y acero, y también para corte en albañilería y hormigón. Se debe utilizar el accesorio adecuado para cada tipo de aplicación - discos abrasivos o discos diamantados. Dispone de una cubierta de protección de 5"" / 125 milímetros con sistema de fijación por perno que asegura que la cubierta no se desplace en caso de ruptura del disco, proporcionando seguridad al operador. Incluye empuñadura auxiliar y un diseño delgado y redondo para mayor comodidad y trabajos menos fatigosos. El interruptor tipo Padel - paleta (de desconexión automática y con sistema que previene accionamientos involuntarios) en la parte inferior de la herramienta ofrece practicidad y seguridad. Su diseño ergonómico permite trabajos más prolongados y su tamaño compacto facilita su uso en espacios reducidos y de difícil acceso.- 900 Watts de potencia. Cubierta de protección de 5"" / 125 milímetros - con sistema de fijación por tornillo.- Interruptor tipo Padle - paleta (de desconexión automática). Diseño compacto. Carcasa de engranajes en aluminio.Especificaciones- Potencia absorbida: 900W- Velocidad de giro en vacío: 11.000rpm- Diámetro de disco: 125mm- Rosca del husillo portamuela: M 14- Interruptor: PROtection- Dimensiones de herramienta (anchura): 73mm- Dimensiones de herramienta (longitud): 280mm- Dimensiones de herramienta (altura): 100mm- Peso: 1,9kgCARACTERÍSTICAS PRINCIPALES:-- Interruptor: PROtection-- Dimensiones de herramienta (anchura): 73mm-- Dimensiones de herramienta (longitud): 280mm-- Dimensiones de herramienta (altura): 100mm-- Peso: 1,9kgPeso del paquete: 2.6 kgModelo: GWS 9-125 PColor: Azul petróleoEAN: 3165140956642GTIN: 3165140956642Baterías incluidas: NoRequiere baterías: NoLargo del cable: 4SKU: GWS 9-125P"
Pulidora 9 2400 W 6500 Rpm Dewalt Dwe4559-b3,1.273.500,,,,Por ferreteria rhino,https://www.mercadolibre.com.co/pulidora-9-2400-w-6500-rpm-dewalt-dwe4559-b3/p/MCO25676260#polycard_client=search-nordic&search_layout=grid&position=28&type=product&tracking_id=64ce5b39-9f12-48d9-99a7-825c139a45ce&wid=MCO1557547647&sid=search,https://http2.mlstatic.com/D_Q_NP_2X_768787-MLU73563684466_122023-E.webp,,,,,"Con tu pulidora DeWalt podrás pulir salientes o bordes, así como soltar remaches, redondear ángulos, cortar metales, etc. Una herramienta clave para las terminaciones de tus proyectos."
Pulidora Angular De Granito/marmol Makita Pk5011c,2.093.400,,,,Por Belltec,https://www.mercadolibre.com.co/pulidora-angular-de-granitomarmol-makita-pk5011c/p/MCO27035402#polycard_client=search-nordic&search_layout=grid&position=29&type=product&tracking_id=64ce5b39-9f12-48d9-99a7-825c139a45ce&wid=MCO1339416011&sid=search,https://http2.mlstatic.com/D_Q_NP_2X_720173-MLU75650627538_042024-E.webp,,,,,"PULIDORA ANGULAR DE GRANITO/MARMOL MAKITA PK5011CMarca: MAKITA HERRAMIENTASCARACTERÍSTICAS GENERALES- Ideal para un pulido eficiente en piedra.- Empuñadura tipo D que permite operar la herramienta con ambas manos para una operación continua.- Interruptor de gatillo resistente al agua.- Cuatro orificios de suministro de agua distribuyen de manera uniforme la humedad en todos los canales de la almohadilla de pulido, protegiendo del sobrecalentamiento y la acumulación de polvo.ESPECIFICACIONES TÉCNICAS- Potencia de entrada: 1.600W- Diámetro de disco: 125mm (5 pulg)- Velocidad sin carga: 2.000-5.500 rpm- Dimensiones (L x A x A): 468x159x155mm (18-1/2 x6-1/4 x6-1/8 pulg)- Peso neto: 3,8Kg (8,4lbs)Modelo: PK5011CColor: Azul petróleo con detalles en negroGTIN: 088381620543CPU: 088381620543Baterías incluidas: NoRequiere baterías: NoSKU: PK5011C"
Pulidora Bosch Vulcano 180mm 2500w Gws 25-180,1.310.000,,,,Por Ferricentro,https://www.mercadolibre.com.co/pulidora-bosch-vulcano-180mm-2500w-gws-25-180/p/MCO26432666#polycard_client=search-nordic&search_layout=grid&position=30&type=product&tracking_id=64ce5b39-9f12-48d9-99a7-825c139a45ce&wid=MCO2762093858&sid=search,https://http2.mlstatic.com/D_Q_NP_2X_794183-MLA84846744087_052025-E.webp,,,,,"PULIDORA BOSCH VULCANO 180MM 2500W GWS 25-180CARACTERÍSTICAS- Alto rendimiento de arranque de material gracias al motor Bosch, con escobillas de carbono más duraderas y menor deceleración en trabajos exigentes.- Sistema de flujo de aire patentado que mejora en un 20 % la refrigeración del motor, incrementando rendimiento y vida útil.- Reducción de vibraciones para mayor confort durante el uso prolongado.- Agarre ergonómico para un control óptimo de la herramienta.- Resistente a la abrasión por partículas de hormigón y hierro.- Motor Bosch de alta eficiencia con elevada tasa de remoción de material.- Interruptor Tri-Control para prevenir activaciones accidentales.- Diseñada para facilitar la reparación con piezas intercambiables.ESPECIFICACIONES- Potencia: 2.500 W- Velocidad: 8.500 rpm- Eje: 5/8""- Diámetro de disco: 180 mm- Peso: 5,8 kgINCLUYE1 mango antivibración, 1 llave de apriete, 1 tuerca de soporte, 1 tuerca de apriete, 1 capa protectoraCARACTERÍSTICAS PRINCIPALES- Potencia: 2.500 W- Velocidad: 8.500 rpm- Eje: 5/8""- Diámetro de disco: 180 mm- Peso: 5,8 kgMÁS DETALLESPeso del paquete: 6.0 kgModelo: GWS 25-180EAN: 4059952587189GTIN: 4059952587189Requiere baterías: NoSKU: GWS 25-180"
Amoladora De Matriz Inal. Vv 1-1/2 Sin Bateria/sin Cargador,1.137.900,,,,Por Belltec,https://www.mercadolibre.com.co/amoladora-de-matriz-inal-vv-1-12-sin-bateriasin-cargador/p/MCO45524820#polycard_client=search-nordic&search_layout=grid&position=31&type=product&tracking_id=64ce5b39-9f12-48d9-99a7-825c139a45ce&wid=MCO2809929450&sid=search,https://http2.mlstatic.com/D_Q_NP_2X_922221-MLA81980291651_012025-E.webp,,,,,PRODUCTO:Nombre: AMOLADORA DE MATRIZ INAL. VV 1-1/2 SIN BATERIA/SIN CARGADOR DCG426BMarca: DEWALT HERRAMIENTASDESCRIPCIÓN:CARACTERÍSTICAS- El motor sin escobillas no requiere cambios de brocha- El interruptor basculante de velocidad variable y la configuración del interruptor de límite de velocidad variable brindan opciones para controlar la velocidad de la herramienta- Las luces led en la parte delantera de la herramienta brindan luz para la superficie de trabajo y el área- Posición doble el interruptor basculante proporciona opciones de usuario para múltiples puntos de agarre del mango.NOTA: NO INCLUYE CARGADOR NI BATERÍA.CARACTERÍSTICAS PRINCIPALES:-- El motor sin escobillas no requiere cambios de brocha-- El interruptor basculante de velocidad variable y la configuración del interruptor de límite de velocidad variable brindan opciones para controlar la velocidad de la herramienta-- Las luces led en la parte delantera de la herramienta brindan luz para la superficie de trabajo y el áreaMÁS DETALLES:Peso del paquete: 5.2 kgEAN: 885911529488ASIN: B076S9YBMHGTIN: 885911529488Baterías incluidas: NoSKU: DCG426B
Pulidora Bosch Vulcano 180mm Gws 2200-180,755.141,,,,,https://www.mercadolibre.com.co/pulidora-bosch-vulcano-180mm-gws-2200-180/p/MCO26432668#polycard_client=search-nordic&search_layout=grid&position=32&type=product&tracking_id=64ce5b39-9f12-48d9-99a7-825c139a45ce&wid=MCO1568364453&sid=search,https://http2.mlstatic.com/D_Q_NP_2X_634485-MLA84558634400_052025-E.webp,,,,,"PULIDORA BOSCH VULCANO 180MM GWS 2200-180CARACTERÍSTICASLa amoladora de 2200 W más ligera del mercado con una excelente relación entre potencia y peso.ESPECIFICACIONESPotencia: 2.200 WVelocidad: 8.500 rpmEje: 5/8""Diámetro de disco: 180 mmPeso: 4,9 kgINCLUYE:1 mango auxiliar, 1 llave de apriete, 1 tuerca de soporte, 1 tuerca de apriete, 1 tapa protectoraNOTA: No incluye discoCARACTERÍSTICAS PRINCIPALES:- Potencia: 2.200 W- Velocidad: 8.500 rpm- Eje: 5/8""- Diámetro de disco: 180 mm- Peso: 4,9 kgMÁS DETALLES:Peso del paquete: 5.0 kgModelo: GWS 2200-180EAN: 4059952527031GTIN: 4059952527031SKU: GWS 2200-180"
Pulidora Angular 9 PuLG Dewalt Dwe490-b3,946.800,,,,Por Belltec,https://articulo.mercadolibre.com.co/MCO-471534701-pulidora-angular-9-pulg-dewalt-dwe490-b3-_JM#polycard_client=search-nordic&search_layout=grid&position=33&type=item&tracking_id=64ce5b39-9f12-48d9-99a7-825c139a45ce&wid=MCO471534701&sid=search,https://http2.mlstatic.com/D_Q_NP_2X_600548-MCO48249205107_112021-E.webp,,,,,"PRODUCTO:Nombre: PULIDORA ANGULAR 9 PULG DEWALT DWE490-B3Marca: DEWALTDESCRIPCIÓN:PULIDORA ANGULAR 9PULG 2200 W - 6500 RPM DEWALT DWE490-B3CARACTERÍSTICAS- Potente motor protegido contra la abrasión que aumenta su durabilidad- Mango auxiliar de dos posiciones para mayor comodidad- Traba de eje para un sencillo cambio de disco- Ventana para fácil acceso y reemplazo de carbonesACCESORIOS INCLUIDOS- Guarda- Mango auxiliar- DiscoESPECIFICACIONES- Potencia: 2200 W- Amperaje: 15 Amps- Velocidad sin carga: 6500 RPM- Eje: 5/8 pulg- Peso: 5,9 kgCARACTERÍSTICAS PRINCIPALES:-- Potencia: 2200 W-- Amperaje: 15 Amps-- Velocidad sin carga: 6500 RPM-- Eje: 5/8 pulg-- Peso: 5,9 kgMÁS DETALLES:Peso del paquete: 6.44 kgCondición: NuevoEAN: 885911436755ASIN: B071NX82CBGTIN: 885911436755SKU: DWE490-B3GRACIAS POR VISITAR SU TIENDA OFICIAL BELLTEC!!!"
Pulidora Bosch Vulcano 180mm 2800w Gws 28-180,1.501.900,,,,Por Belltec,https://articulo.mercadolibre.com.co/MCO-1033115764-pulidora-bosch-vulcano-180mm-2800w-gws-28-180-_JM#polycard_client=search-nordic&search_layout=grid&position=34&type=item&tracking_id=64ce5b39-9f12-48d9-99a7-825c139a45ce&wid=MCO1033115764&sid=search,https://http2.mlstatic.com/D_Q_NP_2X_655169-MCO69820338177_062023-E.webp,,,,,"PRODUCTO:Nombre: PULIDORA BOSCH VULCANO 180MM 2800W GWS 28-180Marca: BOSCHDESCRIPCIÓN:PULIDORA BOSCH VULCANO 180MM 2800W GWS 28-180CARACTERÍSTICAS- La amoladora de 2500 W más ligera del mercado y con la mejor relación potencia-peso.- Alto rendimiento de arranque de material: el nuevo motor Bosch ofrece el mejor rendimiento de su categoría. Con escobillas de carbono más duraderas y menor deceleración en los trabajos pesados.- Flujo de aire optimizado: sistema de flujo de aire patentado que aumenta en un 20 % la refrigeración del motor, lo que aumenta el rendimiento y la vida útil.- Menos fatiga para el usuario: la reducción de las vibraciones permite sobrellevar más horas de trabajo.- Con un agarre más cómodo que permite controlar mejor la herramienta.- Mayor resistencia a la abrasión: mejor resistencia a la abrasión causada por restos de hormigón y hierro que atraviesan el motor de la máquina.- La placa de características grabada al láser permite una mayor duración y facilita las reparaciones.- Interruptor de paleta (opcional): más versiones con interruptor con función de hombre muerto, para una mayor seguridad del usuario.- De fácil reparación: la mayoría de las piezas de recambio son intercambiables entre la herramienta actual y la nueva familia de próximo lanzamientoESPECIFICACIONES- Potencia: 2.800 W- Velocidad: 8.500 rpm- Eje: 5/8""- Diámetro de disco: 180 mm- Peso: 5 kgNO INCLUYE DISCOCARACTERÍSTICAS PRINCIPALES:-Potencia: 2.800 W-Velocidad: 8.500 rpm-Eje: 5/8""-Diámetro de disco: 180 mm-Peso: 5 kgMÁS DETALLES:Peso del paquete: 5.0 kgModelo: GWS 28-180Condición: NuevoColor: Azul petróleoNombre de color: Azul petróleoEAN: 4059952527260GTIN: 4059952527260Requiere baterías: NoLargo del cable: 2SKU: GWS 28-180GRACIAS POR VISITAR SU TIENDA OFICIAL BELLTEC!!!"
Pulidora Angular 4-1/2 PuLG Makita 9564p,642.400,,,,Por Belltec,https://articulo.mercadolibre.com.co/MCO-531193094-pulidora-angular-4-12-pulg-makita-9564p-_JM#polycard_client=search-nordic&search_layout=grid&position=35&type=item&tracking_id=64ce5b39-9f12-48d9-99a7-825c139a45ce&wid=MCO531193094&sid=search,https://http2.mlstatic.com/D_Q_NP_2X_638231-MCO54717790238_032023-E.webp,,,,,"PRODUCTO:Nombre: PULIDORA ANGULAR 4-1/2 PULG MAKITA 9564PMarca: MAKITADESCRIPCIÓN:PULIDORA ANGULAR 4-1/2 PULG SJS 10AMP 10,500 RPMCARACTERÍSTICAS GENERALES- Interruptor tipo paleta fácil de operar.- El nuevo campo con tecnología de cableado superior, conduce una mayor potencia sin aumento de tamaño del motor.- Engranes y rodamientos más durables.- Diseñado especialmente para un trabajo de todo el día.ESPECIFICACIONES TÉCNICAS- Potencia de entrada: 1.400W- Diámetro del disco: 115mm (4-1/2 pulg)- Velocidad sin carga: 10.500 rpm- Dimensiones (L x A x A): 307x129x103mm (12-1/8 x5-1/8 x4 pulg)- Peso neto: 2,4kg (5,3lbs)- Doble AislamientoCARACTERÍSTICAS PRINCIPALES:-- Potencia de entrada: 1.400W-- Diámetro del disco: 115mm (4-1/2 pulg)-- Velocidad sin carga: 10.500 rpm-- Dimensiones (L x A x A): 307x129x103mm (12-1/8 x5-1/8 x4 pulg)-- Peso neto: 2,4kg (5,3lbs)-- Doble AislamientoMÁS DETALLES:Peso del paquete: 2.7 kgModelo: 9564PCondición: NuevoColor: Azul petróleoNombre de color: Azul petróleoColor secundario: NegroASIN: B00BCV57MMBaterías incluidas: NoRequiere baterías: NoSKU: 9564PGRACIAS POR VISITAR SU TIENDA OFICIAL BELLTEC!!!"
